account,name,link,keywords,language
@howlettm@mastodon.social,Michael Howlett,https://mastodon.social/@howlettm,policy_design policy_process resource_policy environmental_policy
@amwellstead@mastodon.social,Adam Wellstead,https://mastodon.social/@amwellstead,policy_labs policy_knowledge climate_change forest_policy
@danimmergluck@maston.social,Dan Immergluck,https://maston.social/@danimmergluck,housing_policy affordable_housing neighborhood_change real_estate finance, urban policy 
@PolicySciences@mastodon.social, Policy Sciences, https://mastodon.social/@PolicySciences, policy_sciences policy_journals policy_studies
@nilsbandelow@mastodon.social, Nils Bandelow, https://mastodon.social/@nilsbandelow, policy_studies, policy_theory
